<?xml version="1.0" encoding="UTF-8"?>
<!DOCTYPE root SYSTEM "PappMarcell_ertodtd.dtd">
<root>
	<A a="asd1">
		<b>
			<x>hello</x>
			<y>hello</y>
		</b>
		<Ac>
			<d>hello</d>
			<e>hello</e>
		</Ac>
	</A>
	<B a="asd2">
		<b>
			<x>hello</x>
			<y>hello</y>
		</b>
	</B>
	<C a="asd3">
		<Cb>Hello</Cb>
	</C>
	<relAB Aid="asd1" Bid="asd2">
		<c>Hello</c>
	</relAB>
	<relBC Bid="asd2" Cid="asd3"/>

</root>